hotel_name,hotel_url,group_label,group_type
Conrad Abu Dhabi Etihad Towers,https://www.hilton.com/en/hotels/auhetci-conrad-abu-dhabi-etihad-towers/,Conrad Hotels & Resorts,Brand
Conrad Algarve,https://www.hilton.com/en/hotels/faoapci-conrad-algarve/,Conrad Hotels & Resorts,Brand
Conrad Bali,https://www.hilton.com/en/hotels/bpncici-conrad-bali/,Conrad Hotels & Resorts,Brand
Conrad Bora Bora Nui,https://www.hilton.com/en/hotels/pptbnci-conrad-bora-bora-nui/,Conrad Hotels & Resorts,Brand
Conrad Chia Laguna Sardinia,https://www.hilton.com/en/hotels/olbclci-conrad-chia-laguna-sardinia/,Conrad Hotels & Resorts,Brand
Conrad Fort Lauderdale Beach,https://www.hilton.com/en/hotels/fllcici-conrad-fort-lauderdale-beach/,Conrad Hotels & Resorts,Brand
Conrad Hangzhou Tonglu,https://www.hilton.com/en/hotels/hghyfci-conrad-hangzhou-tonglu/,Conrad Hotels & Resorts,Brand
Conrad Jiuzhaigou,https://www.hilton.com/en/hotels/jzhcici-conrad-jiuzhaigou/,Conrad Hotels & Resorts,Brand
Conrad Koh Samui,https://www.hilton.com/en/hotels/usmksci-conrad-koh-samui/,Conrad Hotels & Resorts,Brand
Conrad Las Vegas at Resorts World,https://www.hilton.com/en/hotels/rslvhvh-resorts-world-las-vegas/rooms/conrad-las-vegas/,Conrad Hotels & Resorts,Brand
Conrad Maldives Rangali Island,https://www.hilton.com/en/hotels/mlehici-conrad-maldives-rangali-island/,Conrad Hotels & Resorts,Brand
Conrad Orlando,https://www.hilton.com/en/hotels/orlcici-conrad-orlando/,Conrad Hotels & Resorts,Brand
Conrad Punta de Mita,https://www.hilton.com/en/hotels/pvrpmci-conrad-punta-de-mita/,Conrad Hotels & Resorts,Brand
Conrad Rabat Arzana,https://www.hilton.com/en/hotels/rbacici-conrad-rabat-arzana/,Conrad Hotels & Resorts,Brand
Conrad Tulum Riviera Maya,https://www.hilton.com/en/hotels/cuncici-conrad-tulum-riviera-maya/,Conrad Hotels & Resorts,Brand
"Baia di Chia Resort Sardinia, Curio Collection by Hilton",https://www.hilton.com/en/hotels/olbbrqq-baia-di-chia-resort-sardinia/,Curio Collection by Hilton,Brand
"Baker's Cay Resort Key Largo, Curio Collection by Hilton",https://www.hilton.com/en/hotels/kylcuqq-bakers-cay-resort-key-largo/,Curio Collection by Hilton,Brand
"Boeira Garden Hotel Porto Gaia, Curio Collection by Hilton",https://www.hilton.com/en/hotels/opobgqq-boeira-garden-hotel-porto-gaia/,Curio Collection by Hilton,Brand
"Botanika Osa Peninsula, Curio Collection by Hilton",https://www.hilton.com/en/hotels/pjmcrqq-botanika-osa-peninsula/,Curio Collection by Hilton,Brand
"Boulders Resort & Spa Scottsdale, Curio Collection by Hilton",https://www.hilton.com/en/hotels/phxrsqq-boulders-resort-and-spa-scottsdale/,Curio Collection by Hilton,Brand
"Casa Marina Key West, Curio Collection by Hilton",https://www.hilton.com/en/hotels/eywcmqq-casa-marina-key-west/,Curio Collection by Hilton,Brand
"Cloudland at McLemore Resort Lookout Mountain, Curio",https://www.hilton.com/en/hotels/atlokqq-cloudland-at-mclemore-resort-lookout-mountain/,Curio Collection by Hilton,Brand
"Diplomat Beach Resort Hollywood, Curio Collection by Hilton",https://www.hilton.com/en/hotels/flldhqq-the-diplomat-beach-resort-hollywood/,Curio Collection by Hilton,Brand
"Domes Aulus Elounda All-Inclusive Resort, Curio by Hilton",https://www.hilton.com/en/hotels/herbsqq-domes-aulus-elounda-all-inclusive-resort/,Curio Collection by Hilton,Brand
"Faro Blanco Resort & Yacht Club Marathon, Curio by Hilton",https://www.hilton.com/en/hotels/mthfbqq-faro-blanco-resort-and-yacht-club-marathon/,Curio Collection by Hilton,Brand
"Gale South Beach, Curio Collection by Hilton",https://www.hilton.com/en/hotels/miagsqq-gale-south-beach/,Curio Collection by Hilton,Brand
"Grand Hotel des Sablettes Plage, Curio Collection by Hilton",https://www.hilton.com/en/hotels/tlnspqq-grand-hotel-des-sablettes-plage/,Curio Collection by Hilton,Brand
"Harbor Club St. Lucia, Curio Collection by Hilton",https://www.hilton.com/en/hotels/sluhcqq-harbor-club-st-lucia/,Curio Collection by Hilton,Brand
"Higueron Hotel Malaga, Curio Collection by Hilton",https://www.hilton.com/en/hotels/agprhqq-higueron-hotel-malaga/,Curio Collection by Hilton,Brand
"Hotel Alpenrock Breckenridge, Curio Collection by Hilton",https://www.hilton.com/en/hotels/qkbbrqq-alpenrock-breckenridge/,Curio Collection by Hilton,Brand
"Hotel Maren Fort Lauderdale Beach, Curio Collection by Hilton",https://www.hilton.com/en/hotels/fllucqq-hotel-maren-fort-lauderdale-beach/,Curio Collection by Hilton,Brand
"Hotel del Coronado, Curio Collection by Hilton",https://www.hilton.com/en/hotels/sanqqqq-hotel-del-coronado/,Curio Collection by Hilton,Brand
"Il Picciolo Etna Golf Resort & Spa, Curio Collection by Hilton",https://www.hilton.com/en/hotels/ctasiqq-il-piccolo-etna-golf-resort-and-spa/,Curio Collection by Hilton,Brand
Indura Beach & Golf Resort Curio Collection by Hilton,https://www.hilton.com/en/hotels/teaibqq-indura-beach-and-golf-resort/,Curio Collection by Hilton,Brand
"Isla Brown Chania Resort, Curio Collection by Hilton",https://www.hilton.com/en/hotels/heribqq-isla-brown-resort-chania/,Curio Collection by Hilton,Brand
"Isla Brown Corinthia Resort & Spa, Curio Collection by Hilton",https://www.hilton.com/en/hotels/athibqq-isla-brown-corinthia-resort-and-spa/,Curio Collection by Hilton,Brand
"Koi Resort Saint Kitts, Curio Collection by Hilton",https://www.hilton.com/en/hotels/skbkrqq-koi-resort-saint-kitts/,Curio Collection by Hilton,Brand
"La Festa Phu Quoc, Curio Collection by Hilton",https://www.hilton.com/en/hotels/pqcpqqq-la-festa-phu-quoc/,Curio Collection by Hilton,Brand
"La Quinta Resort & Club, Curio Collection by Hilton",https://www.hilton.com/en/hotels/psplqqq-la-quinta-resort-and-club/,Curio Collection by Hilton,Brand
"Lindian Village Beach Resort Rhodes, Curio Collection by Hilton",https://www.hilton.com/en/hotels/rholiqq-lindian-village-beach-resort-rhodes/,Curio Collection by Hilton,Brand
"Mangias Santa Teresa Sardinia, Curio Collection by Hilton",https://www.hilton.com/en/hotels/olbccqq-mangias-santa-teresa-sardinia/,Curio Collection by Hilton,Brand
"Mangrove Beach Corendon Curacao All-Inclusive Resort, Curio",https://www.hilton.com/en/hotels/curryqq-mangrove-beach-corendon-curacao-all-inclusive-resort/,Curio Collection by Hilton,Brand
"SAii Lagoon Maldives, Curio Collection by Hilton",https://www.hilton.com/en/hotels/mlegsqq-saii-lagoon-maldives/,Curio Collection by Hilton,Brand
"Sea Breeze Santorini Beach Resort, Curio Collection",https://www.hilton.com/en/hotels/jtrsbqq-sea-breeze-santorini-beach-resort,Curio Collection by Hilton,Brand
"Semeli Coast Mykonos, Curio Collection by Hilton",https://www.hilton.com/en/hotels/jmkmbqq-semeli-coast-mykonos,Curio Collection by Hilton,Brand
"Skaneateles Fields Resort & Spa, Curio Collection by Hilton",https://www.hilton.com/en/hotels/syrslqq-skaneateles-fields-resort-and-spa,Curio Collection by Hilton,Brand
"Sulia House Porto Rotondo, Curio Collection by Hilton",https://www.hilton.com/en/hotels/olbprqq-sulia-house-porto-rotondo,Curio Collection by Hilton,Brand
"Sunseeker Resort Florida Gulf Coast, Curio by Hilton",https://www.hilton.com/en/hotels/pgdchqq-sunseeker-resort-florida-gulf-coast,Curio Collection by Hilton,Brand
"The Club Cala San Miguel Hotel Ibiza, Curio Collection by Hilton",https://www.hilton.com/en/hotels/ibzseqq-cala-san-miguel-ibiza-resort,Curio Collection by Hilton,Brand
"The Hiatus Clearwater Beach, Curio Collection by Hilton",https://www.hilton.com/en/hotels/tparkqq-the-hiatus-clearwater-beach,Curio Collection by Hilton,Brand
"The Reach Key West, Curio Collection by Hilton",https://www.hilton.com/en/hotels/eywqqqq-the-reach-key-west/,Curio Collection by Hilton,Brand
"The Rif at Mangrove Beach All-Inclusive, Curio by Hilton",https://www.hilton.com/en/hotels/curmgqq-the-rif-at-mangrove-beach-corendon-curacao-all-inclusive/,Curio Collection by Hilton,Brand
"The Royal Senses Resort Crete, Curio Collection by Hilton",https://www.hilton.com/en/hotels/herrsqq-the-royal-senses-resort-and-spa-crete/,Curio Collection by Hilton,Brand
"The Scottsdale Resort and Spa, Curio Collection by Hilton",https://www.hilton.com/en/hotels/phxssqq-the-scottsdale-resort-and-spa/,Curio Collection by Hilton,Brand
"The Singer Oceanfront Resort, Curio Collection by Hilton",https://www.hilton.com/en/hotels/pbisiqq-the-singer-oceanfront-resort/,Curio Collection by Hilton,Brand
"The WB Abu Dhabi, Curio Collection by Hilton",https://www.hilton.com/en/hotels/auhwbqq-the-wb-abu-dhabi-hotel/,Curio Collection by Hilton,Brand
"The Woodlands Resort, Curio Collection by Hilton",https://www.hilton.com/en/hotels/iahwrqq-the-woodlands-resort/,Curio Collection by Hilton,Brand
"Virgin Hotels Las Vegas, Curio Collection by Hilton",https://www.hilton.com/en/hotels/lasvgqq-virgin-hotels-las-vegas/,Curio Collection by Hilton,Brand
"Waterstone Resort & Marina Boca Raton, Curio",https://www.hilton.com/en/hotels/bctbuqq-waterstone-resort-and-marina-boca-raton/,Curio Collection by Hilton,Brand
"Zachari Dunes on Mandalay Beach, Curio Collection by Hilton",https://www.hilton.com/en/hotels/sbazdqq-zachari-dunes-on-mandalay-beach/,Curio Collection by Hilton,Brand
Bahia Mar Fort Lauderdale Beach - a DoubleTree by Hilton,https://www.hilton.com/en/hotels/fllbmdt-bahia-mar-fort-lauderdale-beach/,DoubleTree by Hilton,Brand
DoubleTree Beach Resort by Hilton Tampa Bay - North Redington Beach,https://www.hilton.com/en/hotels/nornhdt-doubletree-beach-resort-tampa-bay-north-redington-beach/,DoubleTree by Hilton,Brand
DoubleTree Fallsview Resort & Spa by Hilton - Niagara Falls,https://www.hilton.com/en/hotels/iagdtdt-doubletree-fallsview-resort-and-spa-niagara-falls/,DoubleTree by Hilton,Brand
DoubleTree Resort Hollywood Beach,https://www.hilton.com/en/hotels/hwofldt-doubletree-resort-hollywood-beach/,DoubleTree by Hilton,Brand
DoubleTree Resort by Hilton Fiji - Sonaisali Island,https://www.hilton.com/en/hotels/nansidi-doubletree-resort-fiji-sonaisali-island/,DoubleTree by Hilton,Brand
DoubleTree Resort by Hilton Grand Key - Key West,https://www.hilton.com/en/hotels/eywdtdt-doubletree-resort-grand-key-key-west/,DoubleTree by Hilton,Brand
DoubleTree Resort by Hilton Lancaster,https://www.hilton.com/en/hotels/lnswvdt-doubletree-resort-lancaster/,DoubleTree by Hilton,Brand
DoubleTree Resort by Hilton Paradise Valley - Scottsdale,https://www.hilton.com/en/hotels/phxsjdt-doubletree-resort-paradise-valley-scottsdale/,DoubleTree by Hilton,Brand
DoubleTree Resort by Hilton Penang,https://www.hilton.com/en/hotels/penmbdi-doubletree-resort-penang/,DoubleTree by Hilton,Brand
DoubleTree Suites by Hilton Orlando - Disney Springs Area,https://www.hilton.com/en/hotels/mcofhdt-doubletree-suites-orlando/,DoubleTree by Hilton,Brand
DoubleTree by Hilton Alana - Waikiki Beach,https://www.hilton.com/en/hotels/hnlkadt-doubletree-alana-waikiki-beach/,DoubleTree by Hilton,Brand
DoubleTree by Hilton Antalya-Kemer All-Inclusive Resort,https://www.hilton.com/en/hotels/aytakdi-doubletree-antalya-kemer-all-inclusive-resort/,DoubleTree by Hilton,Brand
DoubleTree by Hilton Bodrum Isil Club All-Inclusive Resort,https://www.hilton.com/en/hotels/bjvtrdi-doubletree-bodrum-isil-club-all-inclusive-resort/,DoubleTree by Hilton,Brand
DoubleTree by Hilton Damai Laut Resort,https://www.hilton.com/en/hotels/iphdldi-doubletree-damai-laut-resort/,DoubleTree by Hilton,Brand
DoubleTree by Hilton Dubai - Jumeirah Beach,https://www.hilton.com/en/hotels/dxbthdi-doubletree-dubai-jumeirah-beach/,DoubleTree by Hilton,Brand
DoubleTree by Hilton Goa - Arpora - Baga,https://www.hilton.com/en/hotels/goiabdi-doubletree-goa-arpora-baga/,DoubleTree by Hilton,Brand
DoubleTree by Hilton Goa Panaji,https://www.hilton.com/en/hotels/goigddi-doubletree-goa-panaji/,DoubleTree by Hilton,Brand
DoubleTree by Hilton Golf Resort Palm Springs,https://www.hilton.com/en/hotels/pspdpdt-doubletree-golf-resort-palm-springs/,DoubleTree by Hilton,Brand
DoubleTree by Hilton Islantilla Beach Golf Resort,https://www.hilton.com/en/hotels/hevirdi-doubletree-islantilla-beach-golf-resort/,DoubleTree by Hilton,Brand
DoubleTree by Hilton La Torre Golf & Spa Resort,https://www.hilton.com/en/hotels/mjvltdi-doubletree-la-torre-golf-and-spa-resort/,DoubleTree by Hilton,Brand
DoubleTree by Hilton Lagoa Azores,https://www.hilton.com/en/hotels/pdlladi-doubletree-lagoa-azores/,DoubleTree by Hilton,Brand
DoubleTree by Hilton Malta,https://www.hilton.com/en/hotels/mlaspdi-doubletree-malta/,DoubleTree by Hilton,Brand
DoubleTree by Hilton Myrtle Beach,https://www.hilton.com/en/hotels/myrdtdt-doubletree-resort-myrtle-beach-oceanfront/,DoubleTree by Hilton,Brand
DoubleTree by Hilton Noumea Ilot Maitre Resort,https://www.hilton.com/en/hotels/noudidi-doubletree-noumea-ilot-maitre-resort/,DoubleTree by Hilton,Brand
DoubleTree by Hilton Ocean Point Resort & Spa - North Miami,https://www.hilton.com/en/hotels/miaopdt-doubletree-resort-and-spa-ocean-point-north-miami-beach/,DoubleTree by Hilton,Brand
DoubleTree by Hilton Okinawa Chatan Resort,https://www.hilton.com/en/hotels/okadidi-doubletree-okinawa-chatan-resort/,DoubleTree by Hilton,Brand
DoubleTree by Hilton Orlando at SeaWorld,https://www.hilton.com/en/hotels/mcosrdt-doubletree-orlando-at-seaworld/,DoubleTree by Hilton,Brand
DoubleTree by Hilton Park City - The Yarrow,https://www.hilton.com/en/hotels/slcywdt-doubletree-park-city-the-yarrow/,DoubleTree by Hilton,Brand
DoubleTree by Hilton Phuket Banthai Resort,https://www.hilton.com/en/hotels/hktpadi-doubletree-phuket-banthai-resort/,DoubleTree by Hilton,Brand
DoubleTree by Hilton Quebec Resort,https://www.hilton.com/en/hotels/yqbqcdt-doubletree-quebec-resort/,DoubleTree by Hilton,Brand
DoubleTree by Hilton Resort & Spa Marjan Island,https://www.hilton.com/en/hotels/rktmidi-doubletree-resort-and-spa-marjan-island/,DoubleTree by Hilton,Brand
DoubleTree by Hilton San Juan,https://www.hilton.com/en/hotels/sjudtdt-doubletree-san-juan/,DoubleTree by Hilton,Brand
DoubleTree by Hilton Seychelles - Allamanda Resort & Spa,https://www.hilton.com/en/hotels/sezdtdi-doubletree-seychelles-allamanda-resort-and-spa/,DoubleTree by Hilton,Brand
DoubleTree by Hilton Shanwei,https://www.hilton.com/en/hotels/swadidi-doubletree-shanwei/,DoubleTree by Hilton,Brand
DoubleTree by Hilton Sharm El Sheikh - Sharks Bay Resort,https://www.hilton.com/en/hotels/sshsbdi-doubletree-sharm-el-sheikh-sharks-bay-resort/,DoubleTree by Hilton,Brand
DoubleTree by Hilton Weerawila Rajawarna Resort,https://www.hilton.com/en/hotels/wrzrjdi-doubletree-weerawila-rajawarna-resort/,DoubleTree by Hilton,Brand
Doubletree by Hilton Mazatlan,https://www.hilton.com/en/hotels/mztdtdt-doubletree-mazatlan/,DoubleTree by Hilton,Brand
Grand Naniloa Hotel Hilo - a DoubleTree by Hilton,https://www.hilton.com/en/hotels/itohndt-grand-naniloa-hotel-hilo/,DoubleTree by Hilton,Brand
Highline Vail - a DoubleTree by Hilton,https://www.hilton.com/en/hotels/egevcdt-highline-vail/,DoubleTree by Hilton,Brand
Embassy Suites St Augustine Beach Oceanfront Resort,https://www.hilton.com/en/hotels/ustboes-embassy-suites-st-augustine-beach-oceanfront-resort/,Embassy Suites by Hilton,Brand
Embassy Suites by Hilton Aruba Resort,https://www.hilton.com/en/hotels/auajmes-embassy-suites-aruba-resort/,Embassy Suites by Hilton,Brand
Embassy Suites by Hilton Charlotte-Concord-Golf Resort & Spa,https://www.hilton.com/en/hotels/cltcces-embassy-suites-charlotte-concord-golf-resort-and-spa/,Embassy Suites by Hilton,Brand
Embassy Suites by Hilton Deerfield Beach Resort & Spa,https://www.hilton.com/en/hotels/deefles-embassy-suites-deerfield-beach-resort-and-spa/,Embassy Suites by Hilton,Brand
Embassy Suites by Hilton Dorado del Mar Beach Resort,https://www.hilton.com/en/hotels/dorpres-embassy-suites-dorado-del-mar-beach-resort/,Embassy Suites by Hilton,Brand
Embassy Suites by Hilton Greenville Golf Resort & Conf Ctr,https://www.hilton.com/en/hotels/gspeses-embassy-suites-greenville-golf-resort-and-conference-center/,Embassy Suites by Hilton,Brand
Embassy Suites by Hilton Gulf Shores Beach Resort,https://www.hilton.com/en/hotels/gufbees-embassy-suites-gulf-shores-beach-resort/,Embassy Suites by Hilton,Brand
Embassy Suites by Hilton Myrtle Beach Oceanfront Resort,https://www.hilton.com/en/hotels/myreses-embassy-suites-myrtle-beach-oceanfront-resort/,Embassy Suites by Hilton,Brand
Embassy Suites by Hilton Orlando Lake Buena Vista Resort,https://www.hilton.com/en/hotels/mcowdes-embassy-suites-orlando-lake-buena-vista-resort/,Embassy Suites by Hilton,Brand
Embassy Suites by Hilton Orlando Sunset Walk,https://www.hilton.com/en/hotels/mcostes-embassy-suites-orlando-sunset-walk/,Embassy Suites by Hilton,Brand
Embassy Suites by Hilton Panama City Beach Resort,https://www.hilton.com/en/hotels/ecpppes-embassy-suites-panama-city-beach-resort/,Embassy Suites by Hilton,Brand
Embassy Suites by Hilton Scottsdale Resort,https://www.hilton.com/en/hotels/scteses-embassy-suites-scottsdale-resort/,Embassy Suites by Hilton,Brand
Embassy Suites by Hilton Virginia Beach Oceanfront Resort,https://www.hilton.com/en/hotels/orfanes-embassy-suites-virginia-beach-oceanfront-resort/,Embassy Suites by Hilton,Brand
Embassy Suites by Hilton Waikiki Beach Walk,https://www.hilton.com/en/hotels/hnleses-embassy-suites-waikiki-beach-walk/,Embassy Suites by Hilton,Brand
Hampton by Hilton Grand Cayman Seven Mile Beach,https://www.hilton.com/en/hotels/gcmgchx-hampton-grand-cayman-seven-mile-beach/,Hampton by Hilton,Brand
Hampton by Hilton Marjan Island,https://www.hilton.com/en/hotels/rktmahx-hampton-marjan-island/,Hampton by Hilton,Brand
Hilton Club The Beach Resort Sesoko,https://www.hilton.com/en/hotels/okasogv-hilton-club-the-beach-resort-sesoko/,Hilton Grand Vacation Club,Brand
Hilton Grand Vacations Club Anderson Ocean Myrtle Beach,https://www.hilton.com/en/hotels/myraogv-hilton-grand-vacations-club-anderson-ocean-myrtle-beach/,Hilton Grand Vacation Club,Brand
Hilton Grand Vacations Club Elara Center Strip Las Vegas,https://www.hilton.com/en/hotels/lascsgv-hilton-grand-vacations-club-elara-center-strip-las-vegas/,Hilton Grand Vacation Club,Brand
Hilton Grand Vacations Club Flamingo Las Vegas,https://www.hilton.com/en/hotels/lasflgv-hilton-grand-vacations-club-flamingo-las-vegas/,Hilton Grand Vacation Club,Brand
Hilton Grand Vacations Club Grand Waikikian Honolulu,https://www.hilton.com/en/hotels/hnlgwgv-hilton-grand-vacations-club-grand-waikikian-honolulu/,Hilton Grand Vacation Club,Brand
Hilton Grand Vacations Club Hokulani Waikiki Honolulu,https://www.hilton.com/en/hotels/hnlwbgv-hilton-grand-vacations-club-hokulani-waikiki-honolulu/,Hilton Grand Vacation Club,Brand
Hilton Grand Vacations Club Kings' Land Waikoloa,https://www.hilton.com/en/hotels/koaklgv-hilton-grand-vacations-club-kings-land-waikoloa/,Hilton Grand Vacation Club,Brand
Hilton Grand Vacations Club Kohala Suites Waikoloa,https://www.hilton.com/en/hotels/koawbgv-hilton-grand-vacations-club-kohala-suites-waikoloa/,Hilton Grand Vacation Club,Brand
Hilton Grand Vacations Club La Pacifica Los Cabos,https://www.hilton.com/en/hotels/sjdgvgv-hilton-grand-vacations-club-la-pacifica-los-cabos/,Hilton Grand Vacation Club,Brand
Hilton Grand Vacations Club Las Palmeras Orlando,https://www.hilton.com/en/hotels/mcoubgv-hilton-grand-vacations-club-las-palmeras-orlando/,Hilton Grand Vacation Club,Brand
Hilton Grand Vacations Club MarBrisa Carlsbad,https://www.hilton.com/en/hotels/sanmbgv-hilton-grand-vacations-club-marbrisa-carlsbad/,Hilton Grand Vacation Club,Brand
Hilton Grand Vacations Club Maui Bay Villas,https://www.hilton.com/en/hotels/oggmbgv-hilton-grand-vacations-club-maui-bay-villas,Hilton Grand Vacation Club,Brand
Hilton Grand Vacations Club Ocean 22 Myrtle Beach,https://www.hilton.com/en/hotels/myrttgv-hilton-grand-vacations-club-ocean-22-myrtle-beach/,Hilton Grand Vacation Club,Brand
Hilton Grand Vacations Club Ocean Enclave Myrtle Beach,https://www.hilton.com/en/hotels/myroegv-hilton-grand-vacations-club-ocean-enclave-myrtle-beach/,Hilton Grand Vacation Club,Brand
Hilton Grand Vacations Club Ocean Oak Resort Hilton Head,https://www.hilton.com/en/hotels/hhhgvgv-hilton-grand-vacations-club-ocean-oak-resort-hilton-head/,Hilton Grand Vacation Club,Brand
Hilton Grand Vacations Club Ocean Tower Waikoloa Village,https://www.hilton.com/en/hotels/koaotgv-hilton-grand-vacations-club-ocean-tower-waikoloa-village/,Hilton Grand Vacation Club,Brand
Hilton Grand Vacations Club Paradise Las Vegas,https://www.hilton.com/en/hotels/laslvgv-hilton-grand-vacations-club-paradise-las-vegas/,Hilton Grand Vacation Club,Brand
Hilton Grand Vacations Club Parc Soleil Orlando,https://www.hilton.com/en/hotels/mcomdgv-hilton-grand-vacations-club-parc-soleil-orlando/,Hilton Grand Vacation Club,Brand
Hilton Grand Vacations Club SeaWorld Orlando,https://www.hilton.com/en/hotels/orlswgv-hilton-grand-vacations-club-seaworld-orlando/,Hilton Grand Vacation Club,Brand
Hilton Grand Vacations Club Sunrise Lodge Park City,https://www.hilton.com/en/hotels/slcsegv-hilton-grand-vacations-club-sunrise-lodge-park-city/,Hilton Grand Vacation Club,Brand
Hilton Grand Vacations Club The Crane Barbados,https://www.hilton.com/en/hotels/bgicrgv-hilton-grand-vacations-club-the-crane-barbados/,Hilton Grand Vacation Club,Brand
Hilton Grand Vacations Club The Grand Islander Waikiki Honolulu,https://www.hilton.com/en/hotels/hnldrgv-hilton-grand-vacations-club-the-grand-islander-waikiki-honolulu,Hilton Grand Vacation Club,Brand
Hilton Grand Vacations Club Tuscany Village Orlando,https://www.hilton.com/en/hotels/orlingv-hilton-grand-vacations-club-tuscany-village-orlando,Hilton Grand Vacation Club,Brand
Hilton Grand Vacations Club Valdoro Mountain Lodge Breckenridge,https://www.hilton.com/en/hotels/qkbvagv-hilton-grand-vacations-club-valdoro-mountain-lodge-breckenridge,Hilton Grand Vacation Club,Brand
Hilton Grand Vacations Club Whistler,https://www.hilton.com/en/hotels/ywswhgv-hilton-grand-vacations-club-whistler,Hilton Grand Vacation Club,Brand
Hilton Grand Vacations Club at Hilton Hawaiian Village,https://www.hilton.com/en/hotels/hnlhwgv-hilton-grand-vacations-club-at-hilton-hawaiian-village/,Hilton Grand Vacation Club,Brand
Hilton Grand Vacations Club in Sandestin Golf & Beach Resort,https://www.hilton.com/en/hotels/vpssagv-hilton-grand-vacations-club-in-sandestin-golf-and-beach-resort/,Hilton Grand Vacation Club,Brand
Hilton Grand Vacations Club on the Las Vegas Strip,https://www.hilton.com/en/hotels/lasvsgv-hilton-grand-vacations-club-on-the-las-vegas-strip/,Hilton Grand Vacation Club,Brand
Hilton Vacation Club Aqua Sol Orlando West,https://www.hilton.com/en/hotels/mcotkgv-hilton-vacation-club-aqua-sol-orlando,Hilton Grand Vacation Club,Brand
Hilton Vacation Club Cabo Azul Los Cabos,https://www.hilton.com/en/hotels/sjdcagv-hilton-vacation-club-cabo-azul-los-cabos,Hilton Grand Vacation Club,Brand
Hilton Vacation Club Cancun Resort Las Vegas,https://www.hilton.com/en/hotels/lascngv-hilton-vacation-club-cancun-resort-las-vegas,Hilton Grand Vacation Club,Brand
Hilton Vacation Club Cypress Pointe Orlando,https://www.hilton.com/en/hotels/mcotrgv-hilton-vacation-club-cypress-pointe-orlando,Hilton Grand Vacation Club,Brand
Hilton Vacation Club Daytona Beach Regency,https://www.hilton.com/en/hotels/dabdbgv-hilton-vacation-club-daytona-beach-regency,Hilton Grand Vacation Club,Brand
Hilton Vacation Club Flamingo Beach St. Maarten,https://www.hilton.com/en/hotels/sxmflgv-hilton-vacation-club-flamingo-beach-st-maarten,Hilton Grand Vacation Club,Brand
Hilton Vacation Club Grand Beach Orlando,https://www.hilton.com/en/hotels/mcobegv-hilton-vacation-club-grand-beach-orlando,Hilton Grand Vacation Club,Brand
Hilton Vacation Club Greensprings Williamsburg,https://www.hilton.com/en/hotels/phflugv-hilton-vacation-club-greensprings-williamsburg,Hilton Grand Vacation Club,Brand
Hilton Vacation Club Ka'anapali Beach Maui,https://www.hilton.com/en/hotels/jhmkagv-hilton-vacation-club-kaanapali-beach-maui,Hilton Grand Vacation Club,Brand
Hilton Vacation Club Lake Tahoe Resort South,https://www.hilton.com/en/hotels/tvlvagv-hilton-vacation-club-lake-tahoe-resort,Hilton Grand Vacation Club,Brand
Hilton Vacation Club Los Abrigados Resort & Spa Sedona,https://www.hilton.com/en/hotels/sdxplgv-hilton-vacation-club-los-abrigados-sedona,Hilton Grand Vacation Club,Brand
Hilton Vacation Club Mystic Dunes Orlando,https://www.hilton.com/en/hotels/ismmygv-hilton-vacation-club-mystic-dunes-orlando,Hilton Grand Vacation Club,Brand
Hilton Vacation Club Ocean Beach Club Virginia Beach,https://www.hilton.com/en/hotels/orfavgv-hilton-vacation-ocean-beach-club,Hilton Grand Vacation Club,Brand
Hilton Vacation Club Oceanaire Virginia Beach,https://www.hilton.com/en/hotels/orfaigv-hilton-vacation-club-oceanaire-virginia-beach,Hilton Grand Vacation Club,Brand
Hilton Vacation Club Palm Canyon Palm Springs,https://www.hilton.com/en/hotels/pspspgv-hilton-vacation-club-palm-canyon-palm-springs,Hilton Grand Vacation Club,Brand
Hilton Vacation Club Polynesian Isles Kissimmee,https://www.hilton.com/en/hotels/mcopygv-hilton-vacation-club-polynesian-isles-kissimmee,Hilton Grand Vacation Club,Brand
Hilton Vacation Club Rancho Manana Phoenix/Cave Creek,https://www.hilton.com/en/hotels/phxragv-hilton-vacation-club-rancho-manana,Hilton Grand Vacation Club,Brand
Hilton Vacation Club Ridge on Sedona,https://www.hilton.com/en/hotels/flgrigv-hilton-vacation-club-ridge-on-sedona,Hilton Grand Vacation Club,Brand
Hilton Vacation Club Riviera Beach & Shores,https://www.hilton.com/en/hotels/snarbgv-hilton-vacation-club-riviera-beach-and-shores,Hilton Grand Vacation Club,Brand
Hilton Vacation Club Royal Palm St. Maarten,https://www.hilton.com/en/hotels/sxmrogv-hilton-vacation-club-royal-palm-st-maarten,Hilton Grand Vacation Club,Brand
Hilton Vacation Club Scottsdale Links Resort,https://www.hilton.com/en/hotels/phxregv-hilton-vacation-club-scottsdale-links-resort,Hilton Grand Vacation Club,Brand
